<?xml version="1.0" encoding="UTF-8"?>
<!DOCTYPE package PUBLIC
	"-//dPHP Package Description DTD//EN"
	"https://raw.github.com/DDTH/dPHP/master/src/package.dtd">
<package>
	<name>Ddth::Duser</name>
	<version>0.1</version>
	<description>User management library.</description>
	<summary>
		This library provides a simple API for user-management. The
		API provides the access to the following functions:
		- Credentials
		-
		Access Control
		- Profile Management
	</summary>
	<author>
		<author-name>Thanh Ba Nguyen</author-name>
		<author-email>
			btnguyen2k@gmail.com
		</author-email>
	</author>
	<dependencies>
		<dependency>
			<dependency-name>PHP</dependency-name>
			<dependency-version-min>5.0</dependency-version-min>
			<dependency-description></dependency-description>
		</dependency>
		<dependency>
			<dependency-name>Ddth::Commons</dependency-name>
			<dependency-version-min>0.1</dependency-version-min>
			<dependency-description>
			</dependency-description>
		</dependency>
	</dependencies>
</package>