<?xml version="1.0" encoding="UTF-8"?>
<!DOCTYPE package PUBLIC
	"-//dPHP Package Description DTD//EN"
	"https://raw.github.com/DDTH/dPHP/master/src/package.dtd">
<package>
	<name>Ddth::Vnvi</name>
	<version>0.1</version>
	<description>Library to support vi_VN locale.</description>
	<summary>
		This library aims to provide support for vi_VN locale in PHP.
	</summary>
	<author>
		<author-name>Thanh Ba Nguyen</author-name>
		<author-email>
			btnguyen2k@gmail.com
		</author-email>
	</author>
	<dependencies>
		<dependency>
			<dependency-name>PHP</dependency-name>
			<dependency-version-min>5.0</dependency-version-min>
			<dependency-description></dependency-description>
		</dependency>
		<dependency>
			<dependency-name>PHP-mbstring</dependency-name>
			<dependency-description>
				PHP must be compiled with --enable-mbstring.
			</dependency-description>
		</dependency>
	</dependencies>
</package>